{
  "schema_id": "asset-mania/provider-plan",
  "schema_version": "1.0",
  "condition_manifest_sha256": "589980d5eff3f0c7a32e2c2173f5ec1eb863afb1a61ce255957b1964563a0e2c",
  "provider": "openai",
  "endpoint": "/v1/images/edits",
  "model": "gpt-image-2-2026-04-21",
  "attachments": [
    {
      "role": "beauty",
      "multipart_field": "image[]",
      "index": 0,
      "sha256": "3131313131313131313131313131313131313131313131313131313131313131",
      "byte_size": 4097,
      "media_type": "image/png",
      "upload_eligible": true
    },
    {
      "role": "depth_preview",
      "multipart_field": "image[]",
      "index": 1,
      "sha256": "3333333333333333333333333333333333333333333333333333333333333333",
      "byte_size": 4099,
      "media_type": "image/png",
      "upload_eligible": true
    },
    {
      "role": "normal_preview",
      "multipart_field": "image[]",
      "index": 2,
      "sha256": "3535353535353535353535353535353535353535353535353535353535353535",
      "byte_size": 4101,
      "media_type": "image/png",
      "upload_eligible": true
    },
    {
      "role": "mask",
      "multipart_field": "image[]",
      "index": 3,
      "sha256": "3737373737373737373737373737373737373737373737373737373737373737",
      "byte_size": 4103,
      "media_type": "image/png",
      "upload_eligible": true
    }
  ],
  "prompt_sha256": "d1d1d1d1d1d1d1d1d1d1d1d1d1d1d1d1d1d1d1d1d1d1d1d1d1d1d1d1d1d1d1d1",
  "controls": {
    "n": 1,
    "size": "1024x1024",
    "quality": "medium",
    "background": "auto",
    "output_format": "png",
    "output_compression": null,
    "moderation": "auto"
  },
  "subject": "real_person",
  "policy_evidence": {
    "artifact_sha256": "e3e3e3e3e3e3e3e3e3e3e3e3e3e3e3e3e3e3e3e3e3e3e3e3e3e3e3e3e3e3e3e3",
    "source_urls": [
      "https://developers.openai.com/docs/guides/image-generation",
      "https://platform.openai.com/docs/pricing"
    ],
    "retrieved_at": "2026-08-19T08:00:00Z",
    "expires_at": "2026-08-20T08:00:00Z",
    "content_digest": "e1e1e1e1e1e1e1e1e1e1e1e1e1e1e1e1e1e1e1e1e1e1e1e1e1e1e1e1e1e1e1e1",
    "training_default": "not_used_unless_opted_in",
    "application_state": "none",
    "abuse_monitoring_days": 30,
    "zdr": "eligible_with_approval",
    "csam_review_exception": true,
    "effective_region": "unknown"
  },
  "cost_estimate": {
    "currency": "USD",
    "rate_retrieved_at": "2026-08-19T08:00:00Z",
    "rate_digest": "03fdb582fa2235d7006a38ab7ac3d55c9d89aacfebe7835ab408409cf2af0c7e",
    "text_input_tokens_assumed": 120,
    "image_input_tokens_assumed": 3200,
    "cached_text_input_tokens_assumed": 0,
    "cached_image_input_tokens_assumed": 0,
    "n": 1,
    "size": "1024x1024",
    "quality": "medium",
    "formula": "uncached_inputs_plus_published_output_row_v1",
    "rounding": "ceiling_6_decimal_places",
    "estimate_uncertainty": "input_tokens_assumed",
    "estimated_cost": "0.079200",
    "maximum_cost": "0.100000"
  },
  "expected_view": {
    "count": 1,
    "width": 1024,
    "height": 1024,
    "media_type": "image/png",
    "origin": "generated",
    "alignment_issuer": "provider"
  },
  "required_gates": [
    "face_rights",
    "external_egress",
    "paid_compute"
  ],
  "overwrite_policy": "create_only",
  "plan_sha256": "3cf344b8c2c9dc17a79e1e79c036b0f2ee5c261a2618f21b71ea578d65b15671"
}
